<?xml version="1.0" encoding="UTF-8"?>
<?xml-stylesheet type="text/xsl" href="heureka-web.xsl"?>
<SHOP xmlns="urn:x-hujer:feed:heureka" xmlns:xsi="http://www.w3.org/2001/XMLSchema-instance"
	xsi:schemaLocation="urn:x-hujer:feed:heureka heureka.xsd">
	<SHOPITEM>
		<PRODUCT>Nokia 5800 XpressMusic</PRODUCT>
		<DESCRIPTION>Klasický s plným dotykovým uživatelským rozhraním</DESCRIPTION>
		<URL>http://obchod.cz/mobily/nokia-5800-xpressmusic</URL>
		<IMGURL>http://obchod.cz/mobily/nokia-5800- xpressmusic/obrazek.jpg</IMGURL>
		<PRICE>5000</PRICE>
		<PRICE_VAT>6000</PRICE_VAT>
		<VAT>0,20</VAT>
		<ITEM_TYPE>new</ITEM_TYPE>
		<MANUFACTURER>NOKIA</MANUFACTURER>
		<CATEGORYTEXT>Elektronika | Mobilní telefony</CATEGORYTEXT>
		<EAN>6417182041488</EAN>
		<DELIVERY_DATE>2</DELIVERY_DATE>
	</SHOPITEM>
	<SHOPITEM>
		<PRODUCT>Nokia 5800 XpressMusic</PRODUCT>
		<DESCRIPTION>Klasický s plným dotykovým uživatelským rozhraním</DESCRIPTION>
		<URL>http://obchod.cz/mobily/nokia-5800-xpressmusic2</URL>
		<IMGURL>http://obchod.cz/mobily/nokia-5800- xpressmusic/obrazek.jpg</IMGURL>
		<PRICE>5 000,50</PRICE>
		<PRICE_VAT>6000</PRICE_VAT>
		<VAT>0,20</VAT>
	</SHOPITEM>
	<SHOPITEM>
		<PRODUCT>Nokia 5800 XpressMusic</PRODUCT>
		<DESCRIPTION>Klasický s plným dotykovým uživatelským rozhraním</DESCRIPTION>
		<URL>http://obchod.cz/mobily/nokia-5800-xpressmusic3</URL>
		<IMGURL>http://obchod.cz/mobily/nokia-5800- xpressmusic/obrazek.jpg</IMGURL>
		<PRICE>5 000,50</PRICE>
		<PRICE_VAT>6000</PRICE_VAT>
		<VAT>0,20</VAT>
	</SHOPITEM>

	<!-- Ukázka kvalitního XML souboru pro PARFÉMY -->
	<SHOPITEM>
		<PRODUCT>Hugo Boss No.6 toaletní voda 100 ml</PRODUCT>
		<DESCRIPTION>Úspěšný muž nové éry - cílevědomý, úspěšný se zdravou dávkou sebedůvěry. Výrazná mužná vůně...</DESCRIPTION>
		<URL>http://obchodxx.cz/parfemy/hugo-boss-no.6-toaletni-voda-100-ml/</URL>
		<IMGURL>http://obchodxx.cz/parfemy/hugo-boss-no.6-toaletni-voda-100-ml/321/obrazek.jpg</IMGURL>
		<PRICE_VAT>890</PRICE_VAT>
		<MANUFACTURER>Hugo Boss</MANUFACTURER>
		<CATEGORYTEXT>parfémy</CATEGORYTEXT>
		<EAN>7370523511000</EAN>
		<DELIVERY_DATE>2</DELIVERY_DATE>
		<PARAM>
			<PARAM_NAME>Určení</PARAM_NAME>
			<VAL>pánský</VAL>
		</PARAM>
		<PARAM>
			<PARAM_NAME>Typ</PARAM_NAME>
			<VAL>toaletní voda</VAL>
		</PARAM>
		<PARAM>
			<PARAM_NAME>Objem</PARAM_NAME>
			<VAL>100 ml</VAL>
		</PARAM>
		<PARAM>
			<PARAM_NAME>Hlava parfému</PARAM_NAME>
			<VAL>jablko; sladká skořice; bergamot</VAL>
		</PARAM>
		<PARAM>
			<PARAM_NAME>Srdce parfému</PARAM_NAME>
			<VAL>Geranium; hřebíček; mech</VAL>
		</PARAM>
		<PARAM>
			<PARAM_NAME>Základ parfému</PARAM_NAME>
			<VAL>Cedrové dřevo; santalové dřevo; vetiver; olivové dřevo</VAL>
		</PARAM>
		<PARAM>
			<PARAM_NAME>Tester</PARAM_NAME>
			<VAL>ne</VAL>
		</PARAM>
	</SHOPITEM>
	<SHOPITEM>
		<PRODUCT>DKNY Be Delicious parfémovaná voda 100 ml</PRODUCT>
		<DESCRIPTION>Dámská parfemová voda Žena, muž a jablko. To je nová vůně DKNY Be Delicious inspirovaná New Yorkem...</DESCRIPTION>
		<URL>http://obchodxx.cz/parfemy/dkny-be-delicious-parfemovana-voda-100-ml/</URL>
		<IMGURL>http://obchodxx.cz/parfemy/dkny-be-delicious-parfemovana-voda-100-ml/321/obrazek.jpg</IMGURL>
		<PRICE_VAT>1190</PRICE_VAT>
		<MANUFACTURER>DKNY</MANUFACTURER>
		<CATEGORYTEXT>parfémy|parfémovaná voda</CATEGORYTEXT>
		<EAN>7635110098240</EAN>
		<DELIVERY_DATE>2</DELIVERY_DATE>
		<PARAM>
			<PARAM_NAME>Určení</PARAM_NAME>
			<VAL>dámský</VAL>
		</PARAM>
		<PARAM>
			<PARAM_NAME>Typ</PARAM_NAME>
			<VAL>parfémovaná voda</VAL>
		</PARAM>
		<PARAM>
			<PARAM_NAME>Objem</PARAM_NAME>
			<VAL>100 ml</VAL>
		</PARAM>
		<PARAM>
			<PARAM_NAME>Hlava parfému</PARAM_NAME>
			<VAL>zelené jablko; grapefruit; okurka; magnolie</VAL>
		</PARAM>
		<PARAM>
			<PARAM_NAME>Srdce parfému</PARAM_NAME>
			<VAL>Tuberóza; růže; konvalinka; fialka</VAL>
		</PARAM>
		<PARAM>
			<PARAM_NAME>Základ parfému</PARAM_NAME>
			<VAL>světlé dřevo; santalové dřevo; exotické květiny; bílá ambra</VAL>
		</PARAM>
		<PARAM>
			<PARAM_NAME>Tester</PARAM_NAME>
			<VAL>ne</VAL>
		</PARAM>
	</SHOPITEM>

	<SHOPITEM>
		<PRODUCT>Bvlgari pour Homme toaletní voda 100 ml Tester</PRODUCT>
		<DESCRIPTION>Bvlgari Pour Homme EDT 100ml M TESTER Toaletní voda pro muže...</DESCRIPTION>
		<URL>http://obchodxx.cz/parfemy/bvlgari-pour-homme-toaletni-voda-100-ml-tester/</URL>
		<IMGURL>http://obchodxx.cz/parfemy/bvlgari-pour-homme-toaletni-voda-100-ml-tester/321/obrazek.jpg</IMGURL>
		<PRICE_VAT>536</PRICE_VAT>
		<MANUFACTURER>Bvlgari</MANUFACTURER>
		<CATEGORYTEXT>parfémy | toaletni vody</CATEGORYTEXT>
		<EAN>8591110000100</EAN>
		<DELIVERY_DATE>2</DELIVERY_DATE>
		<PARAM>
			<PARAM_NAME>Určení</PARAM_NAME>
			<VAL>pánský</VAL>
		</PARAM>
		<PARAM>
			<PARAM_NAME>Typ</PARAM_NAME>
			<VAL>toaletní voda</VAL>
		</PARAM>
		<PARAM>
			<PARAM_NAME>Objem</PARAM_NAME>
			<VAL>100 ml</VAL>
		</PARAM>
		<PARAM>
			<PARAM_NAME>Hlava parfému</PARAM_NAME>
			<VAL>bergamot; levandule; mandarinka; aldehyd</VAL>
		</PARAM>
		<PARAM>
			<PARAM_NAME>Srdce parfému</PARAM_NAME>
			<VAL>čaj darjeeling; pepř; koriandr; muškát; karafiát</VAL>
		</PARAM>
		<PARAM>
			<PARAM_NAME>Základ parfému</PARAM_NAME>
			<VAL>Cedrové dřevo; jantar; fazole tonka; dubový mech</VAL>
		</PARAM>
		<PARAM>
			<PARAM_NAME>Tester</PARAM_NAME>
			<VAL>ano</VAL>
		</PARAM>
	</SHOPITEM>

	<!-- Ukázka kvalitního XML souboru pro KNIHY -->
	<SHOPITEM>
		<PRODUCT>Tajemství – Jacqueline Wilsonová</PRODUCT>
		<DESCRIPTION>Příběh o přátelství Zlaty a Indie, o dívkách ze sociálně rozdílných rodin. Knížka pro děti okolo deseti let.</DESCRIPTION>
		<URL>http://obchodxx.cz/knihy/122655/Tajemstvi/</URL>
		<IMGURL>http://obchodxx.cz/knihy/122655/Tajemstvi//obrazek.jpg</IMGURL>
		<PRICE_VAT>134</PRICE_VAT>
		<ITEM_TYPE>bazaar</ITEM_TYPE>
		<MANUFACTURER>BB art</MANUFACTURER>
		<CATEGORYTEXT>Knihy | beletrie</CATEGORYTEXT>
		<EAN>9788072579525</EAN>
		<ISBN>80-7257-952-5</ISBN>
		<DELIVERY_DATE>2</DELIVERY_DATE>
		<PARAM>
			<PARAM_NAME>Žánr</PARAM_NAME>
			<VAL>dětská</VAL>
		</PARAM>
		<PARAM>
			<PARAM_NAME>Vazba</PARAM_NAME>
			<VAL>vázaná</VAL>
		</PARAM>
		<PARAM>
			<PARAM_NAME>Autor</PARAM_NAME>
			<VAL>Jacqueline Wilsonová</VAL>
		</PARAM>
		<PARAM>
			<PARAM_NAME>Jazyk</PARAM_NAME>
			<VAL>Česky</VAL>
		</PARAM>
		<PARAM>
			<PARAM_NAME>Počet stran</PARAM_NAME>
			<VAL>186</VAL>
		</PARAM>
		<PARAM>
			<PARAM_NAME>Rok vydání</PARAM_NAME>
			<VAL>2004</VAL>
		</PARAM>
		<PARAM>
			<PARAM_NAME>Nakladatelství</PARAM_NAME>
			<VAL>BB art</VAL>
		</PARAM>
	</SHOPITEM>
	<SHOPITEM>
		<PRODUCT>Tajemství – Danielle Steelová</PRODUCT>
		<DESCRIPTION>beletrie ostatní</DESCRIPTION>
		<URL>http://obchod.cz/knihy/122655/Tajemstvi-Steel/</URL>
		<IMGURL>http://obchod.cz/knihy/122655/Tajemstvi-Steel/obrazek.jpg</IMGURL>
		<PRICE_VAT>67</PRICE_VAT>
		<MANUFACTURER>Ikar</MANUFACTURER>
		<CATEGORYTEXT>Knihy | beletrie</CATEGORYTEXT>
		<EAN>8063859741252</EAN>
		<ISBN>80-6385-974-1</ISBN>
		<DELIVERY_DATE>2</DELIVERY_DATE>
		<PARAM>
			<PARAM_NAME>Žánr</PARAM_NAME>
			<VAL>beletrie</VAL>
		</PARAM>
		<PARAM>
			<PARAM_NAME>Vazba</PARAM_NAME>
			<VAL>vázaná</VAL>
		</PARAM>
		<PARAM>
			<PARAM_NAME>Autor</PARAM_NAME>
			<VAL>Danielle Steel</VAL>
		</PARAM>
		<PARAM>
			<PARAM_NAME>Jazyk</PARAM_NAME>
			<VAL>Česky</VAL>
		</PARAM>
		<PARAM>
			<PARAM_NAME>Počet stran</PARAM_NAME>
			<VAL>237</VAL>
		</PARAM>
		<PARAM>
			<PARAM_NAME>Rok vydání</PARAM_NAME>
			<VAL>1996</VAL>
		</PARAM>
		<PARAM>
			<PARAM_NAME>Nakladatelství</PARAM_NAME>
			<VAL>Ikar</VAL>
		</PARAM>
	</SHOPITEM>

	<SHOPITEM>
		<PRODUCT>Tajemství – Julie Garwood</PRODUCT>
		<DESCRIPTION>Judith Hamptonová, krásná a zároveň cílevědomá anglická dívka, slíbila své skotské přítelkyni z dětství, že jí bude stát po boku, až nastane čas narození jejího dítěte. Ale důvodem Judithina putování na vzdálenou skotskou Vysočinu je ještě něco jiného - touha shledat se s otcem, kterého nikdy nepoznala a o jehož existenci se dověděla teprve nedávno</DESCRIPTION>
		<URL>http://obchod.cz/knihy/122655/Tajemstvi-Garwood/</URL>
		<IMGURL>http://obchod.cz/knihy/122655/Tajemstvi-Garwood/obrazek.jpg</IMGURL>
		<PRICE_VAT>109</PRICE_VAT>
		<MANUFACTURER>OLDAG</MANUFACTURER>
		<CATEGORYTEXT>Knihy | beletrie</CATEGORYTEXT>
		<EAN>8054698231795</EAN>
		<ISBN>80-5469-823-1</ISBN>
		<DELIVERY_DATE>2</DELIVERY_DATE>
		<PARAM>
			<PARAM_NAME>Žánr</PARAM_NAME>
			<VAL>beletrie</VAL>
		</PARAM>
		<PARAM>
			<PARAM_NAME>Vazba</PARAM_NAME>
			<VAL>pevná</VAL>
		</PARAM>
		<PARAM>
			<PARAM_NAME>Autor</PARAM_NAME>
			<VAL>Julie Garwood</VAL>
		</PARAM>
		<PARAM>
			<PARAM_NAME>Jazyk</PARAM_NAME>
			<VAL>Česky</VAL>
		</PARAM>
		<PARAM>
			<PARAM_NAME>Počet stran</PARAM_NAME>
			<VAL>328</VAL>
		</PARAM>
		<PARAM>
			<PARAM_NAME>Rok vydání</PARAM_NAME>
			<VAL>2007</VAL>
		</PARAM>
		<PARAM>
			<PARAM_NAME>Nakladatelství</PARAM_NAME>
			<VAL>OLDAG</VAL>
		</PARAM>
	</SHOPITEM>

	<!-- Ukázka kvalitního XML souboru pro PNEUMATIKY  -->
	<SHOPITEM>
		<PRODUCT>Barum Polaris 2 165/70 R13 79T</PRODUCT>
		<DESCRIPTION>Zimní pneumatiky Barum Polaris 2 165/70 R13 79 T . Nová zimní pneumatika Polaris 2 je nástupcem...</DESCRIPTION>
		<URL>http://obchodxx.cz/pneumatiky/barum-polaris-2-165/70-r13-79t/</URL>
		<IMGURL>http://obchodxx.cz/pneumatiky/barum-polaris-2-165/70-r13-79t/obrazek.jpg</IMGURL>
		<PRICE_VAT>664</PRICE_VAT>
		<MANUFACTURER>Barum</MANUFACTURER>
		<CATEGORYTEXT>pneumatiky|zimni</CATEGORYTEXT>
		<EAN>4024063261297</EAN>
		<DELIVERY_DATE>2</DELIVERY_DATE>
		<PARAM>
			<PARAM_NAME>Období</PARAM_NAME>
			<VAL>zimní</VAL>
		</PARAM>
		<PARAM>
			<PARAM_NAME>Zatížení</PARAM_NAME>
			<VAL>osobní</VAL>
		</PARAM>
		<PARAM>
			<PARAM_NAME>Nominální šířka</PARAM_NAME>
			<VAL>165</VAL>
		</PARAM>
		<PARAM>
			<PARAM_NAME>Vnitřní průměr</PARAM_NAME>
			<VAL>R13</VAL>
		</PARAM>
		<PARAM>
			<PARAM_NAME>Index rychlosti</PARAM_NAME>
			<VAL>T (190km/h)</VAL>
		</PARAM>
		<PARAM>
			<PARAM_NAME>Profil</PARAM_NAME>
			<VAL>70</VAL>
		</PARAM>
		<PARAM>
			<PARAM_NAME>Index nosnosti</PARAM_NAME>